{
  "schemaVersion": 1,
  "protocolVersion": 1,
  "network": "CryLoNexus Mainnet",
  "chainId": 5546,
  "verifierId": "example-verifier-0001",
  "operatorAddress": "0x1111111111111111111111111111111111111111",
  "nodeId": "example-node-public-identity-0001",
  "heartbeatPayloadHash": "0xcccccccccccccccccccccccccccccccccccccccccccccccccccccccccccccccc",
  "observedAt": "2026-07-01T20:00:05Z",
  "result": "PASS",
  "reasonCode": "HEARTBEAT_VALID",
  "latencyMs": 83,
  "observedBlockNumber": 123456,
  "observationHash": "0xeeeeeeeeeeeeeeeeeeeeeeeeeeeeeeeeeeeeeeeeeeeeeeeeeeeeeeeeeeeeeeee",
  "signature": "0xffffffffffffffffffffffffffffffffffffffffffffffffffffffffffffffffffffffffffffffffffffffffffffffffffffffffffffffffffffffffffffffffff"
}
